{
  "arv": "1.0",
  "query": "idle mixture screw",
  "moments": [
    {
      "arv": "1.0",
      "id": "mom_rg2e4kdenkmkzilboihacumshn",
      "moment_uri": "arv:vid_8f2c#t=12400,31000",
      "moment_url": "https://example.com/videos/carb#t=12.4",
      "asset_id": "vid_8f2c",
      "start_ms": 12400,
      "end_ms": 31000,
      "snap": "sentence",
      "kind": "span",
      "title": "Setting the idle mixture screw",
      "evidence": [
        {
          "type": "transcript",
          "start_ms": 12900,
          "end_ms": 18200,
          "text": "Turn the mixture screw a quarter turn out",
          "confidence": 0.93,
          "speaker_id": "spk_1"
        },
        {
          "type": "shot_caption",
          "start_ms": 14000,
          "end_ms": 22000,
          "text": "Close-up of a screwdriver on the idle screw",
          "confidence": 0.81
        }
      ],
      "evidence_grade": "C",
      "confidence": {
        "score": 0.84,
        "band": "high"
      },
      "products": [
        {
          "name": "Flat-blade screwdriver",
          "kind": "physical_product",
          "relation": "shown",
          "url": "https://example.com/tools/flat-screwdriver",
          "evidence": [
            {
              "type": "shot_caption",
              "start_ms": 14000,
              "end_ms": 22000,
              "text": "Close-up of a screwdriver on the idle screw"
            }
          ]
        }
      ],
      "aliases": [
        "legacy_2b7c"
      ]
    }
  ],
  "answer": {
    "arv": "1.0",
    "question": "How do I set the idle mixture on a carburettor?",
    "shape": "steps",
    "coverage": "complete",
    "references": [
      {
        "moment_uri": "arv:vid_8f2c#t=12400,31000",
        "role": "step",
        "step_index": 1,
        "span": {
          "type": "transcript",
          "start_ms": 12900,
          "end_ms": 18200,
          "text": "Turn the mixture screw a quarter turn out"
        }
      },
      {
        "moment_uri": "arv:vid_8f2c#t=31000,52000",
        "role": "step",
        "step_index": 2,
        "span": {
          "type": "transcript",
          "start_ms": 33500,
          "end_ms": 39000,
          "text": "Then turn it back in until the idle is smooth"
        }
      }
    ],
    "actions": [
      {
        "label": "Book a tune-up",
        "action": "book",
        "kind": "service",
        "url": "https://example.com/book"
      }
    ]
  },
  "next_cursor": "c_2"
}
